{
  "$defs": {
    "Diagnostic": {
      "additionalProperties": false,
      "properties": {
        "code": {
          "title": "Code",
          "type": "string"
        },
        "message": {
          "title": "Message",
          "type": "string"
        },
        "severity": {
          "default": "error",
          "enum": [
            "info",
            "warning",
            "error"
          ],
          "title": "Severity",
          "type": "string"
        },
        "instance_id": {
          "anyOf": [
            {
              "type": "string"
            },
            {
              "type": "null"
            }
          ],
          "default": null,
          "title": "Instance Id"
        },
        "field": {
          "anyOf": [
            {
              "type": "string"
            },
            {
              "type": "null"
            }
          ],
          "default": null,
          "title": "Field"
        }
      },
      "required": [
        "code",
        "message"
      ],
      "title": "Diagnostic",
      "type": "object"
    }
  },
  "additionalProperties": false,
  "properties": {
    "status": {
      "title": "Status",
      "type": "string"
    },
    "valid": {
      "title": "Valid",
      "type": "boolean"
    },
    "time_s": {
      "title": "Time S",
      "type": "number"
    },
    "variables": {
      "additionalProperties": {
        "anyOf": [
          {
            "type": "number"
          },
          {
            "type": "integer"
          },
          {
            "type": "string"
          },
          {
            "type": "boolean"
          },
          {
            "type": "null"
          }
        ]
      },
      "title": "Variables",
      "type": "object"
    },
    "diagnostics": {
      "items": {
        "$ref": "#/$defs/Diagnostic"
      },
      "title": "Diagnostics",
      "type": "array"
    },
    "metrics": {
      "additionalProperties": {
        "anyOf": [
          {
            "type": "number"
          },
          {
            "type": "integer"
          },
          {
            "type": "null"
          }
        ]
      },
      "title": "Metrics",
      "type": "object"
    },
    "full": {
      "default": true,
      "title": "Full",
      "type": "boolean"
    },
    "sequence": {
      "default": 0,
      "title": "Sequence",
      "type": "integer"
    },
    "parameter_revision": {
      "default": 0,
      "title": "Parameter Revision",
      "type": "integer"
    }
  },
  "required": [
    "status",
    "valid",
    "time_s"
  ],
  "title": "RunFrame",
  "type": "object",
  "$schema": "https://json-schema.org/draft/2020-12/schema"
}
