{
  "status": "converged",
  "valid": true,
  "time_s": 0.0,
  "variables": {
    "P1.ch0.mass_flow_kg_s": 6.240703169490518,
    "P1.ch0.volume_flow_m3_h": 22.50534759205908,
    "P1.ch0.inlet_pressure_pa": 201325.0,
    "P1.ch0.outlet_pressure_pa": 289369.80167869007,
    "P1.ch0.pressure_drop_pa": -88044.80167869007,
    "P1.mass_flow_kg_s": 6.240703169490518,
    "P1.volume_flow_m3_h": 22.50534759205908,
    "P1.inlet_pressure_pa": 201325.0,
    "P1.outlet_pressure_pa": 289369.80167869007,
    "P1.pressure_drop_pa": -88044.80167869007,
    "P1.shaft_power_w": 733.8810612788247,
    "V1.ch0.mass_flow_kg_s": 3.5826766415095452,
    "V1.ch0.volume_flow_m3_h": 12.919919588757756,
    "V1.ch0.inlet_pressure_pa": 289369.80167869007,
    "V1.ch0.outlet_pressure_pa": 187663.0030733639,
    "V1.ch0.pressure_drop_pa": 101706.79860532616,
    "V1.mass_flow_kg_s": 3.5826766415095452,
    "V1.volume_flow_m3_h": 12.919919588757756,
    "V1.inlet_pressure_pa": 289369.80167869007,
    "V1.outlet_pressure_pa": 187663.0030733639,
    "V1.pressure_drop_pa": 101706.79860532616,
    "L1.ch0.mass_flow_kg_s": 3.5826766415095452,
    "L1.ch0.volume_flow_m3_h": 12.919919588757756,
    "L1.ch0.inlet_pressure_pa": 187663.0030733639,
    "L1.ch0.outlet_pressure_pa": 120000.0,
    "L1.ch0.pressure_drop_pa": 67663.00307336391,
    "L1.mass_flow_kg_s": 3.5826766415095452,
    "L1.volume_flow_m3_h": 12.919919588757756,
    "L1.inlet_pressure_pa": 187663.0030733639,
    "L1.outlet_pressure_pa": 120000.0,
    "L1.pressure_drop_pa": 67663.00307336391,
    "V2.ch0.mass_flow_kg_s": 2.6580265279809727,
    "V2.ch0.volume_flow_m3_h": 9.585428003301326,
    "V2.ch0.inlet_pressure_pa": 289369.80167869007,
    "V2.ch0.outlet_pressure_pa": 170927.18947133506,
    "V2.ch0.pressure_drop_pa": 118442.612207355,
    "V2.mass_flow_kg_s": 2.6580265279809727,
    "V2.volume_flow_m3_h": 9.585428003301326,
    "V2.inlet_pressure_pa": 289369.80167869007,
    "V2.outlet_pressure_pa": 170927.18947133506,
    "V2.pressure_drop_pa": 118442.612207355,
    "L2.ch0.mass_flow_kg_s": 2.6580265279809727,
    "L2.ch0.volume_flow_m3_h": 9.585428003301326,
    "L2.ch0.inlet_pressure_pa": 170927.18947133506,
    "L2.ch0.outlet_pressure_pa": 120000.0,
    "L2.ch0.pressure_drop_pa": 50927.18947133506,
    "L2.mass_flow_kg_s": 2.6580265279809727,
    "L2.volume_flow_m3_h": 9.585428003301326,
    "L2.inlet_pressure_pa": 170927.18947133506,
    "L2.outlet_pressure_pa": 120000.0,
    "L2.pressure_drop_pa": 50927.18947133506,
    "B1.out0.pressure_pa": 201325.0,
    "B1.out0.mass_flow_kg_s": -6.240703169490518,
    "B1.out0.temperature_k": 293.15,
    "P1.in0.pressure_pa": 201325.0,
    "P1.in0.mass_flow_kg_s": 6.240703169490518,
    "P1.in0.temperature_k": null,
    "P1.out0.pressure_pa": 289369.80167869007,
    "P1.out0.mass_flow_kg_s": -6.240703169490518,
    "P1.out0.temperature_k": null,
    "N1.in0.pressure_pa": 289369.80167869007,
    "N1.in0.mass_flow_kg_s": 6.240703169490518,
    "N1.in0.temperature_k": null,
    "N1.out0.pressure_pa": 289369.80167869007,
    "N1.out0.mass_flow_kg_s": -3.5826766415095452,
    "N1.out0.temperature_k": null,
    "N1.out1.pressure_pa": 289369.80167869007,
    "N1.out1.mass_flow_kg_s": -2.6580265279809727,
    "N1.out1.temperature_k": null,
    "V1.in0.pressure_pa": 289369.80167869007,
    "V1.in0.mass_flow_kg_s": 3.5826766415095452,
    "V1.in0.temperature_k": null,
    "V1.out0.pressure_pa": 187663.0030733639,
    "V1.out0.mass_flow_kg_s": -3.5826766415095452,
    "V1.out0.temperature_k": null,
    "L1.in0.pressure_pa": 187663.0030733639,
    "L1.in0.mass_flow_kg_s": 3.5826766415095452,
    "L1.in0.temperature_k": null,
    "L1.out0.pressure_pa": 120000.0,
    "L1.out0.mass_flow_kg_s": -3.5826766415095452,
    "L1.out0.temperature_k": null,
    "V2.in0.pressure_pa": 289369.80167869007,
    "V2.in0.mass_flow_kg_s": 2.6580265279809727,
    "V2.in0.temperature_k": null,
    "V2.out0.pressure_pa": 170927.18947133506,
    "V2.out0.mass_flow_kg_s": -2.6580265279809727,
    "V2.out0.temperature_k": null,
    "L2.in0.pressure_pa": 170927.18947133506,
    "L2.in0.mass_flow_kg_s": 2.6580265279809727,
    "L2.in0.temperature_k": null,
    "L2.out0.pressure_pa": 120000.0,
    "L2.out0.mass_flow_kg_s": -2.6580265279809727,
    "L2.out0.temperature_k": null,
    "N2.in0.pressure_pa": 120000.0,
    "N2.in0.mass_flow_kg_s": -6.2407031694905175,
    "N2.in0.temperature_k": null,
    "N2.out0.pressure_pa": 120000.0,
    "N2.out0.mass_flow_kg_s": 3.5826766415095452,
    "N2.out0.temperature_k": null,
    "N2.out1.pressure_pa": 120000.0,
    "N2.out1.mass_flow_kg_s": 2.6580265279809727,
    "N2.out1.temperature_k": null,
    "B2.out0.pressure_pa": 120000.0,
    "B2.out0.mass_flow_kg_s": 6.2407031694905175,
    "B2.out0.temperature_k": 293.15,
    "B1.param.pressure_pa": 201325.0,
    "B1.param.temperature_k": 293.15,
    "P1.param.speed_ratio": 1.0,
    "P1.param.efficiency_ratio": 0.75,
    "N1.param.elevation_m": 0.0,
    "V1.param.opening_ratio": 0.8,
    "V1.param.kv_m3_h": 16.0,
    "L1.param.length_m": 30.0,
    "L1.param.diameter_m": 0.04,
    "L1.param.roughness_m": 4.5e-05,
    "V2.param.opening_ratio": 0.55,
    "V2.param.kv_m3_h": 16.0,
    "L2.param.length_m": 40.0,
    "L2.param.diameter_m": 0.04,
    "L2.param.roughness_m": 4.5e-05,
    "N2.param.elevation_m": 0.0,
    "B2.param.pressure_pa": 120000.0,
    "B2.param.temperature_k": 293.15
  },
  "diagnostics": [
    {
      "code": "HYDRAULIC_SCOPE",
      "message": "按已应用参数计算定物性液态水水力；Python 模块包在独立 Worker 中执行；控制脚本与热力模型尚未参与求解",
      "severity": "info",
      "instance_id": null,
      "field": null
    }
  ],
  "metrics": {
    "pressure_residual_pa": 1.0186340659856796e-10,
    "mass_residual_kg_s": 4.440892098500626e-16,
    "iterations": 7,
    "node_count": 5,
    "branch_count": 5
  }
}
